{
  "version": "2.0.1",
  "league": "La Liga",
  "week": 5,
  "goals": {
    "Conservative": [
      {
        "home_team": "Real Madrid",
        "away_team": "Valencia CF",
        "date": "2025-09-15",
        "stadium": "",
        "city": "",
        "predictions": {
          "main": {
            "home_win": 0.7,
            "draw": 0.17,
            "away_win": 0.13,
            "top_pick": "Home Win",
            "confidence": 0.7,
            "risk_score": 0.3
          },
          "corners": {
            "total_expected": 9.45,
            "over_7_5": 0.73,
            "over_8_5": 0.6,
            "over_9_5": 0.47,
            "over_10_5": 0.35,
            "over_11_5": 0.24
          }
        }
      },
      {
        "home_team": "Barcelona",
        "away_team": "CA Osasuna",
        "date": "2025-09-15",
        "stadium": "",
        "city": "",
        "predictions": {
          "main": {
            "home_win": 0.67,
            "draw": 0.18,
            "away_win": 0.15,
            "top_pick": "Home Win",
            "confidence": 0.67,
            "risk_score": 0.33
          },
          "corners": {
            "total_expected": 9.5,
            "over_7_5": 0.73,
            "over_8_5": 0.61,
            "over_9_5": 0.48,
            "over_10_5": 0.35,
            "over_11_5": 0.25
          }
        }
      },
      {
        "home_team": "Atlético de Madrid",
        "away_team": "Real Betis",
        "date": "2025-09-15",
        "stadium": "",
        "city": "",
        "predictions": {
          "main": {
            "home_win": 0.56,
            "draw": 0.23,
            "away_win": 0.21,
            "top_pick": "Home Win",
            "confidence": 0.56,
            "risk_score": 0.44
          },
          "corners": {
            "total_expected": 9.49,
            "over_7_5": 0.73,
            "over_8_5": 0.61,
            "over_9_5": 0.48,
            "over_10_5": 0.35,
            "over_11_5": 0.25
          }
        }
      },
      {
        "home_team": "Athletic Club",
        "away_team": "Girona FC",
        "date": "2025-09-15",
        "stadium": "",
        "city": "",
        "predictions": {
          "main": {
            "home_win": 0.67,
            "draw": 0.2,
            "away_win": 0.14,
            "top_pick": "Home Win",
            "confidence": 0.67,
            "risk_score": 0.33
          },
          "corners": {
            "total_expected": 9.62,
            "over_7_5": 0.74,
            "over_8_5": 0.62,
            "over_9_5": 0.49,
            "over_10_5": 0.37,
            "over_11_5": 0.26
          }
        }
      },
      {
        "home_team": "Real Sociedad",
        "away_team": "Sevilla FC",
        "date": "2025-09-15",
        "stadium": "",
        "city": "",
        "predictions": {
          "main": {
            "home_win": 0.35,
            "draw": 0.28,
            "away_win": 0.38,
            "top_pick": "Away Win",
            "confidence": 0.38,
            "risk_score": 0.62
          },
          "corners": {
            "total_expected": 9.48,
            "over_7_5": 0.73,
            "over_8_5": 0.61,
            "over_9_5": 0.48,
            "over_10_5": 0.35,
            "over_11_5": 0.25
          }
        }
      },
      {
        "home_team": "Villarreal CF",
        "away_team": "Getafe CF",
        "date": "2025-09-15",
        "stadium": "",
        "city": "",
        "predictions": {
          "main": {
            "home_win": 0.49,
            "draw": 0.26,
            "away_win": 0.25,
            "top_pick": "Home Win",
            "confidence": 0.49,
            "risk_score": 0.51
          },
          "corners": {
            "total_expected": 9.46,
            "over_7_5": 0.73,
            "over_8_5": 0.6,
            "over_9_5": 0.47,
            "over_10_5": 0.35,
            "over_11_5": 0.24
          }
        }
      },
      {
        "home_team": "Rayo Vallecano",
        "away_team": "RC Celta",
        "date": "2025-09-15",
        "stadium": "",
        "city": "",
        "predictions": {
          "main": {
            "home_win": 0.36,
            "draw": 0.26,
            "away_win": 0.38,
            "top_pick": "Away Win",
            "confidence": 0.38,
            "risk_score": 0.62
          },
          "corners": {
            "total_expected": 9.54,
            "over_7_5": 0.74,
            "over_8_5": 0.61,
            "over_9_5": 0.48,
            "over_10_5": 0.36,
            "over_11_5": 0.25
          }
        }
      },
      {
        "home_team": "Deportivo Alavés",
        "away_team": "RCD Espanyol de Barcelona",
        "date": "2025-09-15",
        "stadium": "",
        "city": "",
        "predictions": {
          "main": {
            "home_win": 0.35,
            "draw": 0.29,
            "away_win": 0.36,
            "top_pick": "Away Win",
            "confidence": 0.36,
            "risk_score": 0.64
          },
          "corners": {
            "total_expected": 9.43,
            "over_7_5": 0.72,
            "over_8_5": 0.6,
            "over_9_5": 0.47,
            "over_10_5": 0.35,
            "over_11_5": 0.24
          }
        }
      },
      {
        "home_team": "RCD Mallorca",
        "away_team": "Elche CF",
        "date": "2025-09-15",
        "stadium": "",
        "city": "",
        "predictions": {
          "main": {
            "home_win": 0.32,
            "draw": 0.28,
            "away_win": 0.4,
            "top_pick": "Away Win",
            "confidence": 0.4,
            "risk_score": 0.6
          },
          "corners": {
            "total_expected": 9.45,
            "over_7_5": 0.73,
            "over_8_5": 0.6,
            "over_9_5": 0.47,
            "over_10_5": 0.35,
            "over_11_5": 0.24
          }
        }
      },
      {
        "home_team": "Levante UD",
        "away_team": "Real Oviedo",
        "date": "2025-09-15",
        "stadium": "",
        "city": "",
        "predictions": {
          "main": {
            "home_win": 0.42,
            "draw": 0.26,
            "away_win": 0.32,
            "top_pick": "Home Win",
            "confidence": 0.42,
            "risk_score": 0.58
          },
          "corners": {
            "total_expected": 9.49,
            "over_7_5": 0.73,
            "over_8_5": 0.61,
            "over_9_5": 0.48,
            "over_10_5": 0.35,
            "over_11_5": 0.25
          }
        }
      }
    ],
    "Balanced": [
      {
        "home_team": "Real Madrid",
        "away_team": "Valencia CF",
        "date": "2025-09-15",
        "stadium": "",
        "city": "",
        "predictions": {
          "main": {
            "home_win": 0.74,
            "draw": 0.15,
            "away_win": 0.11,
            "top_pick": "Home Win",
            "confidence": 0.74,
            "risk_score": 0.26
          },
          "corners": {
            "total_expected": 9.45,
            "over_7_5": 0.73,
            "over_8_5": 0.6,
            "over_9_5": 0.47,
            "over_10_5": 0.35,
            "over_11_5": 0.24
          }
        }
      },
      {
        "home_team": "Barcelona",
        "away_team": "CA Osasuna",
        "date": "2025-09-15",
        "stadium": "",
        "city": "",
        "predictions": {
          "main": {
            "home_win": 0.7,
            "draw": 0.17,
            "away_win": 0.13,
            "top_pick": "Home Win",
            "confidence": 0.7,
            "risk_score": 0.3
          },
          "corners": {
            "total_expected": 9.5,
            "over_7_5": 0.73,
            "over_8_5": 0.61,
            "over_9_5": 0.48,
            "over_10_5": 0.35,
            "over_11_5": 0.25
          }
        }
      },
      {
        "home_team": "Atlético de Madrid",
        "away_team": "Real Betis",
        "date": "2025-09-15",
        "stadium": "",
        "city": "",
        "predictions": {
          "main": {
            "home_win": 0.58,
            "draw": 0.22,
            "away_win": 0.2,
            "top_pick": "Home Win",
            "confidence": 0.58,
            "risk_score": 0.42
          },
          "corners": {
            "total_expected": 9.49,
            "over_7_5": 0.73,
            "over_8_5": 0.61,
            "over_9_5": 0.48,
            "over_10_5": 0.35,
            "over_11_5": 0.25
          }
        }
      },
      {
        "home_team": "Athletic Club",
        "away_team": "Girona FC",
        "date": "2025-09-15",
        "stadium": "",
        "city": "",
        "predictions": {
          "main": {
            "home_win": 0.7,
            "draw": 0.18,
            "away_win": 0.12,
            "top_pick": "Home Win",
            "confidence": 0.7,
            "risk_score": 0.3
          },
          "corners": {
            "total_expected": 9.62,
            "over_7_5": 0.74,
            "over_8_5": 0.62,
            "over_9_5": 0.49,
            "over_10_5": 0.37,
            "over_11_5": 0.26
          }
        }
      },
      {
        "home_team": "Real Sociedad",
        "away_team": "Sevilla FC",
        "date": "2025-09-15",
        "stadium": "",
        "city": "",
        "predictions": {
          "main": {
            "home_win": 0.35,
            "draw": 0.27,
            "away_win": 0.38,
            "top_pick": "Away Win",
            "confidence": 0.38,
            "risk_score": 0.62
          },
          "corners": {
            "total_expected": 9.48,
            "over_7_5": 0.73,
            "over_8_5": 0.61,
            "over_9_5": 0.48,
            "over_10_5": 0.35,
            "over_11_5": 0.25
          }
        }
      },
      {
        "home_team": "Villarreal CF",
        "away_team": "Getafe CF",
        "date": "2025-09-15",
        "stadium": "",
        "city": "",
        "predictions": {
          "main": {
            "home_win": 0.51,
            "draw": 0.25,
            "away_win": 0.24,
            "top_pick": "Home Win",